{
  "id": "tidebound-reavers-treads-c",
  "name": "Tidebound Reaver's Treads",
  "slot": "boots",
  "kind": "armor",
  "grade": "C",
  "materialLadder": "metal",
  "materialRung": 3,
  "weaponType": null,
  "armorFamily": "mail",
  "hands": null,
  "damageType": null,
  "weight": null,
  "baseStats": {
    "defense": 5,
    "hp": 5,
    "dodge": 1
  },
  "requirements": {
    "strength": 11,
    "wisdom": 0
  },
  "affixSlots": 2,
  "affixes": [],
  "plusN": 0,
  "maxPlusN": 6,
  "itemLevel": 1,
  "itemXp": 0,
  "affinities": [],
  "durability": 100,
  "maxDurability": 100,
  "wearK": 1.95,
  "value": 300,
  "classLock": [
    "blade"
  ],
  "setId": "tidebound-reavers-mail",
  "unique": false,
  "uniquePower": null,
  "active": null,
  "consumable": null,
  "ammo": null,
  "visual": {
    "meshId": "armor-mail-boots-01",
    "tintPrimary": "#1e3a4a",
    "tintSecondary": "#9ec5e0",
    "trimMetal": "steel"
  }
}
