{
  "id": "barrow-wardens-gauntlets-a",
  "name": "Barrow Warden's Gauntlets",
  "slot": "gloves",
  "kind": "armor",
  "grade": "A",
  "materialLadder": "metal",
  "materialRung": 5,
  "weaponType": null,
  "armorFamily": "plate",
  "hands": null,
  "damageType": null,
  "weight": null,
  "baseStats": {
    "defense": 9,
    "hp": 9,
    "accuracy": 3
  },
  "requirements": {
    "strength": 19,
    "wisdom": 0
  },
  "affixSlots": 3,
  "affixes": [],
  "plusN": 0,
  "maxPlusN": 8,
  "itemLevel": 1,
  "itemXp": 0,
  "affinities": [],
  "durability": 100,
  "maxDurability": 100,
  "wearK": 3.66,
  "value": 800,
  "classLock": [
    "warden"
  ],
  "setId": "barrow-wardens-vigil",
  "unique": false,
  "uniquePower": null,
  "active": null,
  "consumable": null,
  "ammo": null,
  "visual": {
    "meshId": "armor-plate-gloves-01",
    "tintPrimary": "#4a5148",
    "tintSecondary": "#2f5e4a",
    "trimMetal": "iron"
  }
}
