{
  "id": "tidebound-reavers-mitts",
  "name": "Tidebound Reaver's Mitts",
  "slot": "gloves",
  "kind": "armor",
  "grade": "D",
  "materialLadder": "metal",
  "materialRung": 2,
  "weaponType": null,
  "armorFamily": "mail",
  "hands": null,
  "damageType": null,
  "weight": null,
  "baseStats": {
    "defense": 2,
    "hp": 4,
    "critRate": 1
  },
  "requirements": {
    "strength": 10,
    "wisdom": 0
  },
  "affixSlots": 1,
  "affixes": [],
  "plusN": 0,
  "maxPlusN": 5,
  "itemLevel": 1,
  "itemXp": 0,
  "affinities": [],
  "durability": 100,
  "maxDurability": 100,
  "wearK": 1.56,
  "value": 190,
  "classLock": [
    "blade"
  ],
  "setId": "tidebound-reavers-mail",
  "unique": false,
  "uniquePower": null,
  "active": null,
  "consumable": null,
  "ammo": null,
  "visual": {
    "meshId": "armor-mail-gloves-01",
    "tintPrimary": "#1e3a4a",
    "tintSecondary": "#9ec5e0",
    "trimMetal": "steel"
  }
}
