{
  "id": "superior-ring-of-might",
  "name": "Superior Ring of Might",
  "slot": "ring",
  "kind": "ring",
  "grade": "C",
  "materialLadder": null,
  "materialRung": null,
  "weaponType": null,
  "armorFamily": null,
  "hands": null,
  "damageType": null,
  "weight": null,
  "baseStats": {
    "attackPhys": 5
  },
  "requirements": {
    "strength": 0,
    "wisdom": 0
  },
  "affixSlots": 2,
  "affixes": [],
  "plusN": 0,
  "maxPlusN": 6,
  "itemLevel": 1,
  "itemXp": 0,
  "affinities": [],
  "durability": 100,
  "maxDurability": 100,
  "wearK": 1,
  "value": 360,
  "classLock": [],
  "setId": null,
  "unique": false,
  "uniquePower": null,
  "active": null,
  "consumable": null,
  "ammo": null,
  "visual": {
    "meshId": "ring-might-01",
    "tintPrimary": "#a8b0ba",
    "tintSecondary": "#b91c1c",
    "trimMetal": "steel"
  }
}
