{
  "id": "grinning-companys-gloves",
  "name": "Grinning Company's Gloves",
  "slot": "gloves",
  "kind": "armor",
  "grade": "E",
  "materialLadder": "hide",
  "materialRung": 1,
  "weaponType": null,
  "armorFamily": "leather",
  "hands": null,
  "damageType": null,
  "weight": null,
  "baseStats": {
    "defense": 1,
    "hp": 1,
    "critRate": 2
  },
  "requirements": {
    "strength": 7,
    "wisdom": 0
  },
  "affixSlots": 1,
  "affixes": [],
  "plusN": 0,
  "maxPlusN": 4,
  "itemLevel": 1,
  "itemXp": 0,
  "affinities": [],
  "durability": 100,
  "maxDurability": 100,
  "wearK": 1,
  "value": 120,
  "classLock": [
    "ranger",
    "shade"
  ],
  "setId": "grinning-companys-cut",
  "unique": false,
  "uniquePower": null,
  "active": null,
  "consumable": null,
  "ammo": null,
  "visual": {
    "meshId": "armor-leather-gloves-01",
    "tintPrimary": "#9b1c1c",
    "tintSecondary": "#f1ece4",
    "trimMetal": "brass"
  }
}
