{
  "id": "bronze-shortsword",
  "name": "Bronze Shortsword",
  "slot": "mainHand",
  "kind": "weapon",
  "grade": "E",
  "materialLadder": "metal",
  "materialRung": 1,
  "weaponType": "sword",
  "armorFamily": null,
  "hands": 1,
  "damageType": "slash",
  "weight": 1000,
  "baseStats": {
    "attackPhys": 14,
    "accuracy": 2
  },
  "requirements": {
    "strength": 9,
    "wisdom": 0
  },
  "affixSlots": 1,
  "affixes": [],
  "plusN": 0,
  "maxPlusN": 4,
  "itemLevel": 1,
  "itemXp": 0,
  "affinities": [],
  "durability": 100,
  "maxDurability": 100,
  "wearK": 2,
  "value": 240,
  "classLock": [
    "warden"
  ],
  "setId": null,
  "unique": false,
  "uniquePower": null,
  "active": null,
  "consumable": null,
  "ammo": null,
  "visual": {
    "meshId": "weapon-shortsword-01",
    "tintPrimary": "#cd7f32",
    "tintSecondary": "#4a3626",
    "trimMetal": "bronze"
  }
}
