{
  "id": "copper-stiletto",
  "name": "Copper Stiletto",
  "slot": "mainHand",
  "kind": "weapon",
  "grade": "F",
  "materialLadder": "metal",
  "materialRung": 0,
  "weaponType": "dagger",
  "armorFamily": null,
  "hands": 1,
  "damageType": "pierce",
  "weight": 800,
  "baseStats": {
    "attackPhys": 7
  },
  "requirements": {
    "strength": 6,
    "wisdom": 0
  },
  "affixSlots": 0,
  "affixes": [],
  "plusN": 0,
  "maxPlusN": 3,
  "itemLevel": 1,
  "itemXp": 0,
  "affinities": [],
  "durability": 100,
  "maxDurability": 100,
  "wearK": 1.33,
  "value": 150,
  "classLock": [
    "shade"
  ],
  "setId": null,
  "unique": false,
  "uniquePower": null,
  "active": null,
  "consumable": null,
  "ammo": null,
  "visual": {
    "meshId": "weapon-stiletto-01",
    "tintPrimary": "#b87333",
    "tintSecondary": "#4a3626",
    "trimMetal": "copper"
  }
}
