{
  "id": "copper-gauntlets",
  "name": "Copper Gauntlets",
  "slot": "gloves",
  "kind": "armor",
  "grade": "F",
  "materialLadder": "metal",
  "materialRung": 0,
  "weaponType": null,
  "armorFamily": "plate",
  "hands": null,
  "damageType": null,
  "weight": null,
  "baseStats": {
    "defense": 2,
    "hp": 2,
    "accuracy": 2
  },
  "requirements": {
    "strength": 9,
    "wisdom": 0
  },
  "affixSlots": 0,
  "affixes": [],
  "plusN": 0,
  "maxPlusN": 3,
  "itemLevel": 1,
  "itemXp": 0,
  "affinities": [],
  "durability": 100,
  "maxDurability": 100,
  "wearK": 1,
  "value": 75,
  "classLock": [
    "warden"
  ],
  "setId": null,
  "unique": false,
  "uniquePower": null,
  "active": null,
  "consumable": null,
  "ammo": null,
  "visual": {
    "meshId": "armor-plate-gloves-01",
    "tintPrimary": "#b87333",
    "tintSecondary": "#4a3626",
    "trimMetal": "copper"
  }
}
