{
  "id": "ring-of-finding",
  "name": "Ring of Finding",
  "slot": "ring",
  "kind": "ring",
  "grade": "F",
  "materialLadder": null,
  "materialRung": null,
  "weaponType": null,
  "armorFamily": null,
  "hands": null,
  "damageType": null,
  "weight": null,
  "baseStats": {
    "detection": 1
  },
  "requirements": {
    "strength": 0,
    "wisdom": 0
  },
  "affixSlots": 0,
  "affixes": [],
  "plusN": 0,
  "maxPlusN": 3,
  "itemLevel": 1,
  "itemXp": 0,
  "affinities": [],
  "durability": 100,
  "maxDurability": 100,
  "wearK": 1,
  "value": 90,
  "classLock": [],
  "setId": null,
  "unique": false,
  "uniquePower": null,
  "active": null,
  "consumable": null,
  "ammo": null,
  "visual": {
    "meshId": "ring-finding-01",
    "tintPrimary": "#b87333",
    "tintSecondary": "#0ea5e9",
    "trimMetal": "copper"
  }
}
