{
  "id": "ash-greatstaff",
  "name": "Ash Greatstaff",
  "slot": "mainHand",
  "kind": "weapon",
  "grade": "E",
  "materialLadder": "wood",
  "materialRung": 1,
  "weaponType": "staff",
  "armorFamily": null,
  "hands": 2,
  "damageType": "fire",
  "weight": 1400,
  "baseStats": {
    "attackSpell": 24,
    "mana": 27,
    "speed": -3
  },
  "requirements": {
    "strength": 0,
    "wisdom": 15
  },
  "affixSlots": 1,
  "affixes": [],
  "plusN": 0,
  "maxPlusN": 4,
  "itemLevel": 1,
  "itemXp": 0,
  "affinities": [],
  "durability": 100,
  "maxDurability": 100,
  "wearK": 1.67,
  "value": 360,
  "classLock": [
    "arcanist"
  ],
  "setId": null,
  "unique": false,
  "uniquePower": null,
  "active": null,
  "consumable": null,
  "ammo": null,
  "visual": {
    "meshId": "weapon-greatstaff-01",
    "tintPrimary": "#c9b58a",
    "tintSecondary": "#4a3626",
    "trimMetal": "bronze"
  }
}
